{
  "schemaVersion": "1.0",
  "id": "community.day-planner",
  "version": "1.0.0",
  "name": "План моего дня",
  "description": "Превратите список задач в реалистичный план дня с перерывами и понятными приоритетами.",
  "author": "Вы",
  "runtime": "prompt",
  "permissions": [
    "ai.generate"
  ],
  "prompt": "Составь реалистичный план дня по этим задачам. Уточни приоритеты, предложи перерывы. Не выдумывай встречи и не выполняй действия. Ответь по-русски. Задачи:\n{{input}}"
}
